{
  "receiptVersion": "1",
  "protocolVersion": "1",
  "verifiedAt": 1779062400,
  "verifier": {
    "name": "alx-reference-sample-generator",
    "version": "1.0.0"
  },
  "root": "0x5afb65c5c0b20086456fafd6baa7d5e1f9aaa4441e22d31fc6a75765ea05243c",
  "validationMode": "closed-world",
  "ok": true,
  "complete": true,
  "blockCount": 4,
  "edgeCount": 3,
  "externalParents": [],
  "missingParents": [],
  "errors": [],
  "warnings": []
}
