{
  "receiptVersion": "1",
  "protocolVersion": "1",
  "verifiedAt": 1710000000,
  "verifier": { "name": "alx", "version": "1.0.0" },
  "root": "0xaaaaaaaaaaaaaaaaaaaaaaaaaaaaaaaaaaaaaaaaaaaaaaaaaaaaaaaaaaaaaaaa",
  "validationMode": "closed-world",
  "ok": true,
  "complete": true,
  "blockCount": 2,
  "edgeCount": 1,
  "externalParents": [],
  "missingParents": [],
  "errors": [],
  "warnings": []
}
